{
  "schemaVersion": 1,
  "specVersion": "1.0.0",
  "profile": "full",
  "type": "decision-receipt",
  "generatedAt": "2026-08-26T00:00:00.000Z",
  "provenance": {
    "kind": "deterministic-demo",
    "runId": null,
    "cliVersion": null,
    "workflowId": "product-launch-readiness",
    "policyVersion": null,
    "promptVersion": null,
    "model": null,
    "fixture": true
  },
  "decision": {
    "title": "Product Launch Readiness",
    "summary": "Publish a launch only when a new visitor can reproduce the promised first result, inspect the release, and find a clear boundary around what has not been tested."
  },
  "claims": [
    {
      "id": "claim-1",
      "text": "A release page makes a versioned change set and its target commit inspectable.",
      "status": "supported",
      "evidence": [
        {
          "id": "evidence-1",
          "sourceId": "source-1",
          "excerpt": "A release page makes a versioned change set and its target commit inspectable.",
          "relation": "supports"
        }
      ]
    }
  ],
  "sources": [
    {
      "id": "source-1",
      "title": "About releases",
      "url": "https://docs.github.com/en/repositories/releasing-projects-on-github/about-releases",
      "publisher": "GitHub Docs",
      "role": "versioned release reference",
      "collectedAt": "2026-08-26",
      "captureType": "fixture-synthetic",
      "snapshotPath": "evidence/snapshots/source-1.md",
      "snapshotSha256": "b8c4e042aa6144bcbc2da0433ad416381c0351deadc1c3e6f641f79ecc532b22"
    },
    {
      "id": "source-2",
      "title": "SEO Starter Guide",
      "url": "https://developers.google.com/search/docs/fundamentals/seo-starter-guide",
      "publisher": "Google Search Central",
      "role": "public discoverability reference",
      "collectedAt": "2026-08-26",
      "captureType": "fixture-synthetic",
      "snapshotPath": "evidence/snapshots/source-2.md",
      "snapshotSha256": "1916637420c514c171ffa05ba3b17eec5cd6ff67569da540412a76cc6081a2c5"
    },
    {
      "id": "source-3",
      "title": "Web Task Agent v0.2.0",
      "url": "https://github.com/OthmaneBlial/web-task-agent/releases/tag/v0.2.0",
      "publisher": "Web Task Agent",
      "role": "project release artifact",
      "collectedAt": "2026-08-26",
      "captureType": "fixture-synthetic",
      "snapshotPath": "evidence/snapshots/source-3.md",
      "snapshotSha256": "94fe43fa0b7f3ff0617d4a0b2b07bf47b4c1a919bf56d51e797329330fb9d8e6"
    }
  ],
  "contradictions": [
    {
      "id": "limitation-1",
      "topic": "invalidation",
      "evidenceIds": [],
      "note": "The installation or demo path could fail on a clean machine."
    }
  ],
  "nextValidation": "Run the deterministic demo on a clean machine, open the published release and site, then ask three target operators which artifact they inspected first and what they still could not verify.",
  "limitations": [
    "This is a deterministic fixture; it is not fresh web research.",
    "Hashes prove artifact integrity, not the truth, completeness, authorization, or freshness of a source."
  ],
  "integrity": {
    "algorithm": "sha256",
    "manifestPath": "integrity-manifest.json",
    "note": "The manifest covers exported files; receipt structure and evidence references are validated separately."
  }
}
