{
  "schemaVersion": 1,
  "specVersion": "1.0.0",
  "profile": "full",
  "type": "decision-receipt",
  "generatedAt": "2026-08-26T00:00:00.000Z",
  "provenance": {
    "kind": "deterministic-demo",
    "runId": null,
    "cliVersion": null,
    "workflowId": "technical-article-brief",
    "policyVersion": null,
    "promptVersion": null,
    "model": null,
    "fixture": true
  },
  "decision": {
    "title": "Technical Article Brief",
    "summary": "Write a technical article only after the implementation claims, caveats, and source links can survive a reader opening the cited documentation."
  },
  "claims": [
    {
      "id": "claim-1",
      "text": "Protocol-level browser tooling exposes a concrete automation boundary that should be documented rather than implied.",
      "status": "supported",
      "evidence": [
        {
          "id": "evidence-1",
          "sourceId": "source-1",
          "excerpt": "Protocol-level browser tooling exposes a concrete automation boundary that should be documented rather than implied.",
          "relation": "supports"
        }
      ]
    }
  ],
  "sources": [
    {
      "id": "source-1",
      "title": "Chrome DevTools Protocol",
      "url": "https://chromedevtools.github.io/devtools-protocol/",
      "publisher": "Chrome DevTools",
      "role": "browser protocol reference",
      "collectedAt": "2026-08-26",
      "captureType": "fixture-synthetic",
      "snapshotPath": "evidence/snapshots/source-1.md",
      "snapshotSha256": "032d6b052eb2a08ef6185865f811ae9bd850b76f1184512b2490a08ab44fb46d"
    },
    {
      "id": "source-2",
      "title": "Lightpanda documentation",
      "url": "https://lightpanda.io/docs/",
      "publisher": "Lightpanda",
      "role": "browser runtime reference",
      "collectedAt": "2026-08-26",
      "captureType": "fixture-synthetic",
      "snapshotPath": "evidence/snapshots/source-2.md",
      "snapshotSha256": "3d2bbc0d060522edf73e42ac5e6fcf6c10220f34478d6693b9c3b4594ba1d92d"
    },
    {
      "id": "source-3",
      "title": "Web Task Agent article-research workflow",
      "url": "https://github.com/OthmaneBlial/web-task-agent/blob/main/docs/content/example-article-research.md",
      "publisher": "Web Task Agent",
      "role": "project workflow reference",
      "collectedAt": "2026-08-26",
      "captureType": "fixture-synthetic",
      "snapshotPath": "evidence/snapshots/source-3.md",
      "snapshotSha256": "e7f925d173ebe53d486faa54633b8ff1bd9a6a361783dceacf54bc0a633f0d61"
    }
  ],
  "contradictions": [
    {
      "id": "limitation-1",
      "topic": "invalidation",
      "evidenceIds": [],
      "note": "The protocol or runtime documentation could change before publication."
    }
  ],
  "nextValidation": "Re-run every command from the draft, reopen each primary source, and have a technical reviewer mark claims that need a narrower scope or a reproducible example.",
  "limitations": [
    "This is a deterministic fixture; it is not fresh web research.",
    "Hashes prove artifact integrity, not the truth, completeness, authorization, or freshness of a source."
  ],
  "integrity": {
    "algorithm": "sha256",
    "manifestPath": "integrity-manifest.json",
    "note": "The manifest covers exported files; receipt structure and evidence references are validated separately."
  }
}
