{
  "schemaVersion": 1,
  "specVersion": "1.0.0",
  "profile": "full",
  "type": "decision-receipt",
  "generatedAt": "2026-08-26T00:00:00.000Z",
  "provenance": {
    "kind": "deterministic-demo",
    "runId": null,
    "cliVersion": null,
    "workflowId": "workflow-quality-audit",
    "policyVersion": null,
    "promptVersion": null,
    "model": null,
    "fixture": true
  },
  "decision": {
    "title": "Workflow Quality Audit",
    "summary": "Accept a workflow only when it addresses a repeated operator decision and produces a stable evidence-backed handoff."
  },
  "claims": [
    {
      "id": "claim-1",
      "text": "Review a proposed research workflow for a repeated decision, a distinct source strategy, an explicit output contract, and disconfirming evidence.",
      "status": "supported",
      "evidence": [
        {
          "id": "evidence-1",
          "sourceId": "source-1",
          "excerpt": "Review a proposed research workflow for a repeated decision, a distinct source strategy, an explicit output contract, and disconfirming evidence.",
          "relation": "supports"
        }
      ]
    }
  ],
  "sources": [
    {
      "id": "source-1",
      "title": "Web Task Agent workflow contribution guidance",
      "url": "https://github.com/OthmaneBlial/web-task-agent/blob/main/CONTRIBUTING.md",
      "publisher": "Web Task Agent",
      "role": "contribution contract",
      "collectedAt": "2026-08-26",
      "captureType": "fixture-synthetic",
      "snapshotPath": "evidence/snapshots/source-1.md",
      "snapshotSha256": "3186f70870e97dbf3f16aa30800f041bd8a0a0df814c6a158b87e18a96d20129"
    },
    {
      "id": "source-2",
      "title": "Web Task Agent workflow catalog",
      "url": "https://github.com/OthmaneBlial/web-task-agent/blob/main/examples/workflows/CATALOG.md",
      "publisher": "Web Task Agent",
      "role": "existing workflow comparison",
      "collectedAt": "2026-08-26",
      "captureType": "fixture-synthetic",
      "snapshotPath": "evidence/snapshots/source-2.md",
      "snapshotSha256": "40f9aeb07e5bed62aad027b419917d7981517823169b9c2fc2bf4f0412a78759"
    },
    {
      "id": "source-3",
      "title": "Web Task Agent workflow proposal form",
      "url": "https://github.com/OthmaneBlial/web-task-agent/blob/main/.github/ISSUE_TEMPLATE/workflow-proposal.yml",
      "publisher": "Web Task Agent",
      "role": "review intake contract",
      "collectedAt": "2026-08-26",
      "captureType": "fixture-synthetic",
      "snapshotPath": "evidence/snapshots/source-3.md",
      "snapshotSha256": "830e8c17303ce60489f35854c46cfed84d9ce94bd161b882c66cb442be401013"
    }
  ],
  "contradictions": [],
  "nextValidation": "Use this rubric against a contributor proposal and record the reviewer decision in the pull request.",
  "limitations": [
    "This is a deterministic fixture; it is not fresh web research.",
    "Hashes prove artifact integrity, not the truth, completeness, authorization, or freshness of a source."
  ],
  "integrity": {
    "algorithm": "sha256",
    "manifestPath": "integrity-manifest.json",
    "note": "The manifest covers exported files; receipt structure and evidence references are validated separately."
  }
}
