{
  "schemaVersion": 1,
  "specVersion": "1.0.0",
  "profile": "full",
  "type": "decision-receipt",
  "generatedAt": "2026-08-26T00:00:00.000Z",
  "provenance": {
    "kind": "deterministic-demo",
    "runId": null,
    "cliVersion": null,
    "workflowId": "github-issue-opportunity",
    "policyVersion": null,
    "promptVersion": null,
    "model": null,
    "fixture": true
  },
  "decision": {
    "title": "GitHub Issue Opportunity",
    "summary": "Route incoming repository feedback to the smallest public space that preserves its evidence and makes review expectations clear."
  },
  "claims": [
    {
      "id": "claim-1",
      "text": "Issues work best for reproducible bugs and focused implementation changes.",
      "status": "supported",
      "evidence": [
        {
          "id": "evidence-1",
          "sourceId": "source-1",
          "excerpt": "Issues work best for reproducible bugs and focused implementation changes.",
          "relation": "supports"
        }
      ]
    }
  ],
  "sources": [
    {
      "id": "source-1",
      "title": "About issues",
      "url": "https://docs.github.com/en/issues/tracking-your-work-with-issues/learning-about-issues/about-issues",
      "publisher": "GitHub Docs",
      "role": "issue-tracking reference",
      "collectedAt": "2026-08-26",
      "captureType": "fixture-synthetic",
      "snapshotPath": "evidence/snapshots/source-1.md",
      "snapshotSha256": "4e7c2d5dcb8c2db72b693011feb34a79d447c9a3ea7356109c7df1131a89988a"
    },
    {
      "id": "source-2",
      "title": "Managing labels",
      "url": "https://docs.github.com/en/issues/using-labels-and-milestones-to-track-work/managing-labels",
      "publisher": "GitHub Docs",
      "role": "review-state reference",
      "collectedAt": "2026-08-26",
      "captureType": "fixture-synthetic",
      "snapshotPath": "evidence/snapshots/source-2.md",
      "snapshotSha256": "fd325e2d58f1a41a20d92f8ffd7a986fff7f514494b11c5d49128dcb120b2a53"
    },
    {
      "id": "source-3",
      "title": "About discussions",
      "url": "https://docs.github.com/en/discussions/collaborating-with-your-community-using-discussions/about-discussions",
      "publisher": "GitHub Docs",
      "role": "community discussion reference",
      "collectedAt": "2026-08-26",
      "captureType": "fixture-synthetic",
      "snapshotPath": "evidence/snapshots/source-3.md",
      "snapshotSha256": "1579f4f94e31a28adedbd26609cb49059558793231ba84f661a1c66493c558ea"
    }
  ],
  "contradictions": [
    {
      "id": "limitation-1",
      "topic": "invalidation",
      "evidenceIds": [],
      "note": "A contributor may need a lightweight issue before they can produce a full workflow proposal."
    }
  ],
  "nextValidation": "Take three incoming requests, route them using the documented rules, and ask the authors whether the expected next step was clear within five minutes.",
  "limitations": [
    "This is a deterministic fixture; it is not fresh web research.",
    "Hashes prove artifact integrity, not the truth, completeness, authorization, or freshness of a source."
  ],
  "integrity": {
    "algorithm": "sha256",
    "manifestPath": "integrity-manifest.json",
    "note": "The manifest covers exported files; receipt structure and evidence references are validated separately."
  }
}
