{
  "schemaVersion": 1,
  "specVersion": "1.0.0",
  "profile": "full",
  "type": "decision-receipt",
  "generatedAt": "2026-08-26T00:00:00.000Z",
  "provenance": {
    "kind": "deterministic-demo",
    "runId": null,
    "cliVersion": null,
    "workflowId": "browser-agent-landscape",
    "policyVersion": null,
    "promptVersion": null,
    "model": null,
    "fixture": true
  },
  "decision": {
    "title": "Browser Agent Landscape",
    "summary": "Position Web Task Agent around local, evidence-backed decision packages rather than generic browser control or crawling."
  },
  "claims": [
    {
      "id": "claim-1",
      "text": "Browser Use publicly positions natural-language web automation across extraction, multi-step workflows, research, monitoring, testing, and scheduling.",
      "status": "supported",
      "evidence": [
        {
          "id": "evidence-1",
          "sourceId": "source-1",
          "excerpt": "Browser Use publicly positions natural-language web automation across extraction, multi-step workflows, research, monitoring, testing, and scheduling.",
          "relation": "supports"
        }
      ]
    }
  ],
  "sources": [
    {
      "id": "source-1",
      "title": "Browser Use introduction",
      "url": "https://docs.browser-use.com/cloud/agent/quickstart",
      "publisher": "Browser Use",
      "role": "browser-agent capability reference",
      "collectedAt": "2026-08-26",
      "captureType": "fixture-synthetic",
      "snapshotPath": "evidence/snapshots/source-1.md",
      "snapshotSha256": "29a54b9371cab7dce27adc98dc5099c5896c52fe80de1385e85979d2f0c284b0"
    },
    {
      "id": "source-2",
      "title": "Choosing the Data Extractor",
      "url": "https://docs.firecrawl.dev/developer-guides/usage-guides/choosing-the-data-extractor",
      "publisher": "Firecrawl",
      "role": "web discovery and extraction reference",
      "collectedAt": "2026-08-26",
      "captureType": "fixture-synthetic",
      "snapshotPath": "evidence/snapshots/source-2.md",
      "snapshotSha256": "469eafb3ac78ff7841a76902d790ce80d43b80a720b9ba80cddef168bc6b3d42"
    },
    {
      "id": "source-3",
      "title": "Deep Agents overview",
      "url": "https://docs.langchain.com/oss/python/deepagents/overview",
      "publisher": "LangChain",
      "role": "durable execution and review reference",
      "collectedAt": "2026-08-26",
      "captureType": "fixture-synthetic",
      "snapshotPath": "evidence/snapshots/source-3.md",
      "snapshotSha256": "87f19bb21466b1d5b2b44b9699ce875842c6e6986118dbddbd58e449d6e0b014"
    }
  ],
  "contradictions": [
    {
      "id": "limitation-1",
      "topic": "invalidation",
      "evidenceIds": [],
      "note": "A competing product could expose an equally usable local evidence graph and resumable decision package."
    }
  ],
  "nextValidation": "Run the article-research workflow on a current agent topic, then ask an operator whether they can trace every recommendation to a source without opening the database.",
  "limitations": [
    "This is a deterministic fixture; it is not fresh web research.",
    "Hashes prove artifact integrity, not the truth, completeness, authorization, or freshness of a source."
  ],
  "integrity": {
    "algorithm": "sha256",
    "manifestPath": "integrity-manifest.json",
    "note": "The manifest covers exported files; receipt structure and evidence references are validated separately."
  }
}
