{
  "schemaVersion": 1,
  "specVersion": "1.0.0",
  "profile": "full",
  "type": "decision-receipt",
  "generatedAt": "2026-08-26T00:00:00.000Z",
  "provenance": {
    "kind": "deterministic-demo",
    "runId": null,
    "cliVersion": null,
    "workflowId": "local-first-risk-review",
    "policyVersion": null,
    "promptVersion": null,
    "model": null,
    "fixture": true
  },
  "decision": {
    "title": "Local-First Risk Review",
    "summary": "Treat browser pages, search snippets, files, and LLM responses as untrusted inputs. Keep operator approval at the boundary where data leaves the machine or a sensitive action could occur."
  },
  "claims": [
    {
      "id": "claim-1",
      "text": "Review a local research run for unsafe targets, secret exposure, source manipulation, and unsafe sharing before treating its output as ready.",
      "status": "supported",
      "evidence": [
        {
          "id": "evidence-1",
          "sourceId": "source-1",
          "excerpt": "Review a local research run for unsafe targets, secret exposure, source manipulation, and unsafe sharing before treating its output as ready.",
          "relation": "supports"
        }
      ]
    }
  ],
  "sources": [
    {
      "id": "source-1",
      "title": "OWASP Top 10 for LLM Applications",
      "url": "https://owasp.org/www-project-top-10-for-large-language-model-applications/",
      "publisher": "OWASP",
      "role": "prompt-injection and data-handling reference",
      "collectedAt": "2026-08-26",
      "captureType": "fixture-synthetic",
      "snapshotPath": "evidence/snapshots/source-1.md",
      "snapshotSha256": "02fd5ac2e9387d075482cae8d4fc7a8e6c4b8895a9668571194387dac374c123"
    },
    {
      "id": "source-2",
      "title": "Web Task Agent security policy",
      "url": "https://github.com/OthmaneBlial/web-task-agent/blob/main/SECURITY.md",
      "publisher": "Web Task Agent",
      "role": "project security boundary",
      "collectedAt": "2026-08-26",
      "captureType": "fixture-synthetic",
      "snapshotPath": "evidence/snapshots/source-2.md",
      "snapshotSha256": "06be46d392040ef2aa92dfa3c15c7da2cf1ced7e32fd9f649d78b0e8f5daa7c4"
    },
    {
      "id": "source-3",
      "title": "Web Task Agent privacy contract",
      "url": "https://github.com/OthmaneBlial/web-task-agent/blob/main/PRIVACY.md",
      "publisher": "Web Task Agent",
      "role": "local-data boundary",
      "collectedAt": "2026-08-26",
      "captureType": "fixture-synthetic",
      "snapshotPath": "evidence/snapshots/source-3.md",
      "snapshotSha256": "c72e296f32c845f7278a14d590ab3ad1bfec1f0c5f8f658b70f8c05ad6dc1e55"
    }
  ],
  "contradictions": [],
  "nextValidation": "Run source-policy and redaction tests for every new fetcher, output writer, and provider adapter.",
  "limitations": [
    "This is a deterministic fixture; it is not fresh web research.",
    "Hashes prove artifact integrity, not the truth, completeness, authorization, or freshness of a source."
  ],
  "integrity": {
    "algorithm": "sha256",
    "manifestPath": "integrity-manifest.json",
    "note": "The manifest covers exported files; receipt structure and evidence references are validated separately."
  }
}
