{
  "schemaVersion": 1,
  "specVersion": "1.0.0",
  "profile": "full",
  "type": "decision-receipt",
  "generatedAt": "2026-08-26T00:00:00.000Z",
  "provenance": {
    "kind": "deterministic-demo",
    "runId": null,
    "cliVersion": null,
    "workflowId": "competitor-decision-map",
    "policyVersion": null,
    "promptVersion": null,
    "model": null,
    "fixture": true
  },
  "decision": {
    "title": "Competitor Decision Map",
    "summary": "Position a product by the operator decision and retained artifact it improves, not by copying a competitor feature list."
  },
  "claims": [
    {
      "id": "claim-1",
      "text": "Browser automation, extraction, and durable agent execution solve overlapping but different operator problems.",
      "status": "supported",
      "evidence": [
        {
          "id": "evidence-1",
          "sourceId": "source-1",
          "excerpt": "Browser automation, extraction, and durable agent execution solve overlapping but different operator problems.",
          "relation": "supports"
        }
      ]
    }
  ],
  "sources": [
    {
      "id": "source-1",
      "title": "Browser Use introduction",
      "url": "https://docs.browser-use.com/cloud/agent/quickstart",
      "publisher": "Browser Use",
      "role": "browser automation capability reference",
      "collectedAt": "2026-08-26",
      "captureType": "fixture-synthetic",
      "snapshotPath": "evidence/snapshots/source-1.md",
      "snapshotSha256": "3ffb70331e7378367e2987364255c9a5661c706762fdd10448510c62e871ba89"
    },
    {
      "id": "source-2",
      "title": "Choosing the Data Extractor",
      "url": "https://docs.firecrawl.dev/developer-guides/usage-guides/choosing-the-data-extractor",
      "publisher": "Firecrawl",
      "role": "web extraction capability reference",
      "collectedAt": "2026-08-26",
      "captureType": "fixture-synthetic",
      "snapshotPath": "evidence/snapshots/source-2.md",
      "snapshotSha256": "818d0aa8d1688882bc1928b238b67ccd71dbe08ba05eaad5b39a2f69e05d4bcf"
    },
    {
      "id": "source-3",
      "title": "Deep Agents overview",
      "url": "https://docs.langchain.com/oss/python/deepagents/overview",
      "publisher": "LangChain",
      "role": "durable agent execution reference",
      "collectedAt": "2026-08-26",
      "captureType": "fixture-synthetic",
      "snapshotPath": "evidence/snapshots/source-3.md",
      "snapshotSha256": "b68055c6f766a0ab7c28eb8a2c63461a9bb98190cd6be7ffeafe337d91e67efd"
    }
  ],
  "contradictions": [
    {
      "id": "limitation-1",
      "topic": "invalidation",
      "evidenceIds": [],
      "note": "A competing tool may already provide an equally usable local source trail and handoff."
    }
  ],
  "nextValidation": "Re-check the linked primary documentation, choose one operator decision, and compare the artifacts produced by each approach rather than only their feature lists.",
  "limitations": [
    "This is a deterministic fixture; it is not fresh web research.",
    "Hashes prove artifact integrity, not the truth, completeness, authorization, or freshness of a source."
  ],
  "integrity": {
    "algorithm": "sha256",
    "manifestPath": "integrity-manifest.json",
    "note": "The manifest covers exported files; receipt structure and evidence references are validated separately."
  }
}
