{
  "schemaVersion": 1,
  "specVersion": "1.0.0",
  "profile": "full",
  "type": "decision-receipt",
  "generatedAt": "2026-08-26T00:00:00.000Z",
  "provenance": {
    "kind": "deterministic-demo",
    "runId": null,
    "cliVersion": null,
    "workflowId": "app-review-opportunity",
    "policyVersion": null,
    "promptVersion": null,
    "model": null,
    "fixture": true
  },
  "decision": {
    "title": "App Review Opportunity",
    "summary": "Treat app reviews as discovery evidence for repeated pains and workarounds, then validate the proposed opportunity before committing to a product direction."
  },
  "claims": [
    {
      "id": "claim-1",
      "text": "Review feedback can reveal repeated language, friction, and missing expectations that are worth clustering.",
      "status": "supported",
      "evidence": [
        {
          "id": "evidence-1",
          "sourceId": "source-1",
          "excerpt": "Review feedback can reveal repeated language, friction, and missing expectations that are worth clustering.",
          "relation": "supports"
        }
      ]
    }
  ],
  "sources": [
    {
      "id": "source-1",
      "title": "Android app quality",
      "url": "https://developer.android.com/quality",
      "publisher": "Android Developers",
      "role": "platform quality reference",
      "collectedAt": "2026-08-26",
      "captureType": "fixture-synthetic",
      "snapshotPath": "evidence/snapshots/source-1.md",
      "snapshotSha256": "8dc3a309cfb5c191d6dc204b014b21414649d7b57c86287c949f40921874e508"
    },
    {
      "id": "source-2",
      "title": "View and analyze your app's ratings and reviews",
      "url": "https://support.google.com/googleplay/android-developer/answer/138230?hl=en",
      "publisher": "Google Play Console Help",
      "role": "review-system reference",
      "collectedAt": "2026-08-26",
      "captureType": "fixture-synthetic",
      "snapshotPath": "evidence/snapshots/source-2.md",
      "snapshotSha256": "3e999d51ede02c8e552adfa84edb46212a67110bfd8599d070c93dea254fb1da"
    },
    {
      "id": "source-3",
      "title": "Web Task Agent Android opportunity example",
      "url": "https://github.com/OthmaneBlial/web-task-agent/blob/main/docs/content/example-android-opportunity.md",
      "publisher": "Web Task Agent",
      "role": "project workflow reference",
      "collectedAt": "2026-08-26",
      "captureType": "fixture-synthetic",
      "snapshotPath": "evidence/snapshots/source-3.md",
      "snapshotSha256": "575fa7dff75111adaa86e4cf80b19d617e0b52675c7e1c97ebbc48dc607cc1f1"
    }
  ],
  "contradictions": [
    {
      "id": "limitation-1",
      "topic": "invalidation",
      "evidenceIds": [],
      "note": "Reviews may be old, unrepresentative, manipulated, or about a resolved version."
    }
  ],
  "nextValidation": "Collect fresh reviews with dates and app versions, compare against release notes and official product behavior, then test one narrow problem statement with target users.",
  "limitations": [
    "This is a deterministic fixture; it is not fresh web research.",
    "Hashes prove artifact integrity, not the truth, completeness, authorization, or freshness of a source."
  ],
  "integrity": {
    "algorithm": "sha256",
    "manifestPath": "integrity-manifest.json",
    "note": "The manifest covers exported files; receipt structure and evidence references are validated separately."
  }
}
